{
  "schemaVersion": 2,
  "packageName": "WSR-Core",
  "version": "1.5.0",
  "buildId": "WSR-CORE-1.5.0-RELEASE",
  "manifestSha256": "fecb81754051b9df64f5af1e09d045439681004642fddd54e72620294bfe2ec2",
  "commandMap": {
    "goal": {
      "workflow": "global_workflows/goal.md",
      "description": "Authorize one bounded Goal execution and its task receipts",
      "readOnly": false,
      "approvalRequired": true,
      "requiredProfile": "task"
    },
    "audit": {
      "workflow": "global_workflows/audit.md",
      "description": "Run deterministic integrity, structure, minimality, dependency, resource, and IDE audits",
      "readOnly": true,
      "approvalRequired": false,
      "requiredProfile": "command",
      "entrypoint": "scripts/wsr_audit.py"
    },
    "br": {
      "workflow": "global_workflows/br.md",
      "description": "Trigger brainstorm mode for discussions",
      "readOnly": true,
      "approvalRequired": false,
      "requiredProfile": "command"
    },
    "pl": {
      "workflow": "global_workflows/pl.md",
      "description": "Trigger planning workflow and create planning file",
      "readOnly": true,
      "approvalRequired": false,
      "requiredProfile": "command"
    },
    "clean": {
      "workflow": "global_workflows/clean.md",
      "description": "Scan and remove temporary/unwanted files",
      "readOnly": false,
      "approvalRequired": true,
      "requiredProfile": "command",
      "entrypoint": "scripts/wsr_clean.py"
    },
    "reload": {
      "workflow": "global_workflows/reload.md",
      "description": "Verify a released WSR source and emit a read-only reload receipt",
      "readOnly": true,
      "approvalRequired": false,
      "requiredProfile": "command",
      "entrypoint": "scripts/wsr_reload.py"
    },
    "wsr": {
      "workflow": "global_workflows/wsr.md",
      "description": "WSR packaging workflow",
      "readOnly": false,
      "approvalRequired": true,
      "requiredProfile": "command"
    },
    "backup": {
      "workflow": "global_workflows/backup.md",
      "description": "Create ZIP backup of workspace",
      "readOnly": false,
      "approvalRequired": true,
      "requiredProfile": "command"
    },
    "commit": {
      "workflow": "global_workflows/commit.md",
      "description": "Commit all changes and push to GitHub",
      "readOnly": false,
      "approvalRequired": true,
      "requiredProfile": "command"
    },
    "sync": {
      "workflow": "global_workflows/sync.md",
      "description": "Auto-detect latest release and execute configuration sync without prompt re-approval",
      "readOnly": false,
      "approvalRequired": true,
      "requiredProfile": "command",
      "entrypoint": "scripts/sync_config.py"
    },
    "ho": {
      "workflow": "global_workflows/ho.md",
      "description": "Alias /pl \u1edf ch\u1ebf \u0111\u1ed9 handoff",
      "readOnly": true,
      "approvalRequired": false,
      "requiredProfile": "command",
      "aliasOf": "pl",
      "mode": "handoff"
    }
  },
  "skillIndex": [
    {
      "capabilityId": "wsr-audit",
      "name": "WSR Audit Skill",
      "description": "Deterministic six-category WSR audit standards",
      "trigger": "audit, static check, syntax check",
      "path": "skills/wsr-audit/SKILL.md",
      "contentHash": "d299aafd8df337c1be1c1c34af5908aaa79619b7b7858876f5d76916798121fa",
      "scope": "global",
      "priority": 10
    },
    {
      "capabilityId": "wsr-debt",
      "name": "WSR Debt Scanner Skill",
      "description": "Technical debt scanning standards and ceiling controls",
      "trigger": "debt, debt scan, wsr-debt",
      "path": "skills/wsr-debt/SKILL.md",
      "contentHash": "626c64cd8e9be6d113a52a05da78708166c43f01d196dfe1f8c1641940809edb",
      "scope": "global",
      "priority": 10
    },
    {
      "capabilityId": "wsr-review",
      "name": "WSR Review Skill",
      "description": "Standard code and package review guidelines",
      "trigger": "review, code review, wsr-review",
      "path": "skills/wsr-review/SKILL.md",
      "contentHash": "ed5ed1169db58d062914f2f3be6d5e1395921bc06107de00bd0d371158600376",
      "scope": "global",
      "priority": 10
    },
    {
      "capabilityId": "dec-dev-operator",
      "name": "DEC Dev Operator",
      "description": "DEC System development operator skill",
      "trigger": "dec, dev operator, dec system",
      "path": "global_skills/dec-dev-operator/SKILL.md",
      "contentHash": "6d87eec72822088e732ef96566fcd4487763a2587f4f8e1e78b6c3edf4d18ccb",
      "references": [
        "global_skills/dec-dev-operator/references/DEC_UI_skill.md"
      ],
      "scope": "global",
      "priority": 20
    },
    {
      "capabilityId": "effective-html",
      "name": "Effective HTML",
      "description": "HTML layout and design standards",
      "trigger": "html, UI, layout",
      "path": "global_skills/effective-html/SKILL.md",
      "contentHash": "5cf76935ece32d44ffd4788f3ce95ce1813a3fa090acc9e65c2e9e2c2de42bbf",
      "scope": "global",
      "priority": 5
    },
    {
      "capabilityId": "liquid-glass-web-win",
      "name": "Liquid Glass Web Win",
      "description": "Liquid Glass design system guidelines",
      "trigger": "liquid glass, glassmorphism, UI design",
      "path": "global_skills/LiquidGlass/skills/liquid-glass-web-win/SKILL.md",
      "contentHash": "bbde76768942afabb2715d3739fc2fd1a25755dd067a27472959d31295786b3b",
      "references": [
        "global_skills/LiquidGlass/skills/liquid-glass-web-win/references/liquid-glass-web.md"
      ],
      "scope": "global",
      "priority": 5
    },
    {
      "capabilityId": "output-skill",
      "name": "Output Skill",
      "description": "Output formatting guidelines",
      "trigger": "output, format, full output",
      "path": "global_skills/output-skill/SKILL.md",
      "contentHash": "e5bf48b1ae561511439cf71672209a10a88cee0968cc925909ff861dfa0a96a7",
      "scope": "global",
      "priority": 5
    },
    {
      "capabilityId": "redesign-skill",
      "name": "Redesign Skill",
      "description": "UI redesign and visual overhaul rules",
      "trigger": "redesign, visual update",
      "path": "global_skills/redesign-skill/SKILL.md",
      "contentHash": "98ad3e5b051bfb71b2795f7e8a6aa0d32b51ee095606c098a4b2822ac07926c9",
      "scope": "global",
      "priority": 5
    },
    {
      "capabilityId": "soft-skill",
      "name": "Soft Skill",
      "description": "High-end visual design and anti-generic UI taste",
      "trigger": "soft-skill, visual design, high-end ui, anti-generic",
      "path": "global_skills/soft-skill/SKILL.md",
      "contentHash": "e1e32f5e2d420872c6c7332b53d5ff7721946766b78c4822b424c2d512c8fdbc",
      "scope": "global",
      "priority": 5
    },
    {
      "capabilityId": "stitch-skill",
      "name": "Stitch Skill",
      "description": "Stitch UI integration and design taste",
      "trigger": "stitch, UI design taste",
      "path": "global_skills/stitch-skill/SKILL.md",
      "contentHash": "46bdb08fee2dded38b6ba0a051230a502d6ac6e4044afd47592cb40c256028b5",
      "references": [
        "global_skills/stitch-skill/DESIGN.md"
      ],
      "scope": "global",
      "priority": 5
    },
    {
      "capabilityId": "taste-skill",
      "name": "Taste Skill (v2)",
      "description": "Anti-slop frontend framework for landing pages, portfolios, and redesigns",
      "trigger": "taste, frontend, ui, anti-slop, gsap, layout, design system",
      "path": "global_skills/taste-skill/SKILL.md",
      "contentHash": "113c1753c2e9fbc27439df5dec98ae0b8b08c5884a3795889fb5b0fe6b698926",
      "scope": "global",
      "priority": 5,
      "references": [
        "global_skills/taste-skill/references/taste-skill-guide.md"
      ]
    },
    {
      "capabilityId": "taste-skill-v1",
      "name": "Taste Skill (v1)",
      "description": "Original v1 taste-skill preserved for backward compatibility",
      "trigger": "taste-v1, legacy taste, frontend v1",
      "path": "global_skills/taste-skill-v1/SKILL.md",
      "contentHash": "033d45af1ed23832730642f95f40ab49db7fb5222848489a6c5656144bfc6dae",
      "scope": "global",
      "priority": 5
    },
    {
      "capabilityId": "gpt-taste",
      "name": "GPT Taste Skill",
      "description": "Elite UX/UI and GSAP motion engineering for GPT/Codex models",
      "trigger": "gpt-taste, codex ui, gsap motion, awwwards, variance",
      "path": "global_skills/gpt-tasteskill/SKILL.md",
      "contentHash": "2e64c269953f2656c21bf5a0fa6b4568e82fe0c72b36e8f84758e090349966a5",
      "scope": "global",
      "priority": 5
    }
  ],
  "loadProfiles": {
    "startup": {
      "layers": [
        "kernel",
        "command_index"
      ],
      "maxTokens": 1000
    },
    "command": {
      "layers": [
        "kernel",
        "command_index",
        "active_workflow"
      ],
      "maxTokens": 1800
    },
    "task": {
      "layers": [
        "kernel",
        "command_index",
        "active_workflow",
        "matched_skills"
      ],
      "maxTokens": 6000
    },
    "resume": {
      "layers": [
        "kernel",
        "command_index",
        "session_descriptor",
        "session_references"
      ],
      "maxTokens": 4000
    },
    "diagnostic": {
      "layers": [
        "all_declared_artifacts"
      ],
      "maxTokens": 100000,
      "explicitOnly": true
    }
  },
  "precedenceRules": [
    "safety",
    "closest_project_rule",
    "active_workflow",
    "matched_skill",
    "resume_reference"
  ],
  "tokenBudget": {
    "estimator": "ceil(utf8_chars/4)",
    "enforcedPerProfile": true
  },
  "contextThreshold": {
    "warningPercent": 60,
    "handoffPercent": 75,
    "criticalPercent": 85,
    "action": "checkpoint_then_stop"
  },
  "contextTelemetry": {
    "reportEveryResponse": true,
    "lineFormat": "[Context: ~X% | Tr\u1ea1ng th\u00e1i: ...]",
    "measurementPriority": [
      "native",
      "estimate"
    ],
    "fallback": "estimate",